{"authorization":{"authorization_token":"sha256:b5fe4ee85f59935a32d6b1a93cf7a5ec64fdbb51348fab624d83c4292f646109","path":"evals/m4/authorization/m4.1/execution-authorization.json","raw_sha256":"8e706255d032cb861135e2d13ef2ab640af97f19de980e501455cba3785fa259"},"batch_order":["M4.1-BATCH-NUC","M4.1-BATCH-MEC","M4.1-BATCH-ELE","M4.1-BATCH-AUT","M4.1-BATCH-COM","M4.1-BATCH-MPH"],"batches":[{"batch_id":"M4.1-BATCH-NUC","domain":"nuclear_engineering","later_batches_mutable_after_observation":false,"planned_task_count":10,"source_batch_id":"M4-BATCH-NUC","source_task_ids":["M4-NUC-A-F","M4-NUC-B-A1","M4-NUC-A-A1","M4-NUC-B-A3","M4-NUC-A-A2","M4-NUC-B-F","M4-NUC-A-N","M4-NUC-B-A2","M4-NUC-A-A3","M4-NUC-B-N"],"stop_on_infrastructure_or_protocol_failure":true,"task_ids":["M4.1-NUC-A-F","M4.1-NUC-B-A1","M4.1-NUC-A-A1","M4.1-NUC-B-A3","M4.1-NUC-A-A2","M4.1-NUC-B-F","M4.1-NUC-A-N","M4.1-NUC-B-A2","M4.1-NUC-A-A3","M4.1-NUC-B-N"]},{"batch_id":"M4.1-BATCH-MEC","domain":"mechanical_engineering","later_batches_mutable_after_observation":false,"planned_task_count":10,"source_batch_id":"M4-BATCH-MEC","source_task_ids":["M4-MEC-A-N","M4-MEC-A-A1","M4-MEC-B-F","M4-MEC-A-A3","M4-MEC-B-A3","M4-MEC-B-A1","M4-MEC-B-A2","M4-MEC-A-A2","M4-MEC-A-F","M4-MEC-B-N"],"stop_on_infrastructure_or_protocol_failure":true,"task_ids":["M4.1-MEC-A-N","M4.1-MEC-A-A1","M4.1-MEC-B-F","M4.1-MEC-A-A3","M4.1-MEC-B-A3","M4.1-MEC-B-A1","M4.1-MEC-B-A2","M4.1-MEC-A-A2","M4.1-MEC-A-F","M4.1-MEC-B-N"]},{"batch_id":"M4.1-BATCH-ELE","domain":"electrical_engineering","later_batches_mutable_after_observation":false,"planned_task_count":10,"source_batch_id":"M4-BATCH-ELE","source_task_ids":["M4-ELE-B-A2","M4-ELE-B-A1","M4-ELE-A-A1","M4-ELE-A-N","M4-ELE-A-F","M4-ELE-B-A3","M4-ELE-B-N","M4-ELE-B-F","M4-ELE-A-A3","M4-ELE-A-A2"],"stop_on_infrastructure_or_protocol_failure":true,"task_ids":["M4.1-ELE-B-A2","M4.1-ELE-B-A1","M4.1-ELE-A-A1","M4.1-ELE-A-N","M4.1-ELE-A-F","M4.1-ELE-B-A3","M4.1-ELE-B-N","M4.1-ELE-B-F","M4.1-ELE-A-A3","M4.1-ELE-A-A2"]},{"batch_id":"M4.1-BATCH-AUT","domain":"automation_control","later_batches_mutable_after_observation":false,"planned_task_count":10,"source_batch_id":"M4-BATCH-AUT","source_task_ids":["M4-AUT-B-A2","M4-AUT-B-A3","M4-AUT-A-A3","M4-AUT-B-A1","M4-AUT-A-A1","M4-AUT-B-N","M4-AUT-A-A2","M4-AUT-B-F","M4-AUT-A-N","M4-AUT-A-F"],"stop_on_infrastructure_or_protocol_failure":true,"task_ids":["M4.1-AUT-B-A2","M4.1-AUT-B-A3","M4.1-AUT-A-A3","M4.1-AUT-B-A1","M4.1-AUT-A-A1","M4.1-AUT-B-N","M4.1-AUT-A-A2","M4.1-AUT-B-F","M4.1-AUT-A-N","M4.1-AUT-A-F"]},{"batch_id":"M4.1-BATCH-COM","domain":"computer_data","later_batches_mutable_after_observation":false,"planned_task_count":10,"source_batch_id":"M4-BATCH-COM","source_task_ids":["M4-COM-B-F","M4-COM-B-A1","M4-COM-B-A2","M4-COM-A-N","M4-COM-B-N","M4-COM-A-A3","M4-COM-B-A3","M4-COM-A-A2","M4-COM-A-F","M4-COM-A-A1"],"stop_on_infrastructure_or_protocol_failure":true,"task_ids":["M4.1-COM-B-F","M4.1-COM-B-A1","M4.1-COM-B-A2","M4.1-COM-A-N","M4.1-COM-B-N","M4.1-COM-A-A3","M4.1-COM-B-A3","M4.1-COM-A-A2","M4.1-COM-A-F","M4.1-COM-A-A1"]},{"batch_id":"M4.1-BATCH-MPH","domain":"multiphysics","later_batches_mutable_after_observation":false,"planned_task_count":10,"source_batch_id":"M4-BATCH-MPH","source_task_ids":["M4-MPH-B-F","M4-MPH-A-N","M4-MPH-A-A2","M4-MPH-A-A1","M4-MPH-A-A3","M4-MPH-B-A2","M4-MPH-A-F","M4-MPH-B-N","M4-MPH-B-A1","M4-MPH-B-A3"],"stop_on_infrastructure_or_protocol_failure":true,"task_ids":["M4.1-MPH-B-F","M4.1-MPH-A-N","M4.1-MPH-A-A2","M4.1-MPH-A-A1","M4.1-MPH-A-A3","M4.1-MPH-B-A2","M4.1-MPH-A-F","M4.1-MPH-B-N","M4.1-MPH-B-A1","M4.1-MPH-B-A3"]}],"does_not_authorize":["a second attempt for any M4.1 task ID","a retry, repair, continuation, or follow-up message","a task outside the frozen 60-task M4.1 matrix","cross-task or cross-arm result visibility","judge execution, blind-map access, or unblinding","result aggregation or acceptance-threshold claims","changes to cases, prompts, variants, rubric, thresholds, or randomization","M4 closure, M5, an experiment, simulation, training run, deployment, or control action"],"execution_constraints":{"allowed_tool_capabilities":["scholarly_discovery_readonly","citation_metadata_verification_readonly","web_search_readonly"],"cross_task_result_visibility":false,"exact_model_id":"gpt-5.6-sol","forbidden_actions":["write_user_files","start_services","download_models","upload_research_materials","execute_experiment_or_simulation","train_or_deploy_models","control_physical_systems"],"input_context_token_ceiling":32000,"model_binding_status":"BOUND_BY_M4_1_GATE_IV_AUTHORIZATION","one_independent_context_per_task":true,"one_independent_finalization_per_task":true,"output_token_ceiling":8000,"reasoning_effort":"max","same_model_across_arms":true,"same_scoring_contract_across_arms":true,"same_task_retry_count":0,"same_user_input_across_arms":true,"search_query_budget":12,"tool_profile_id":"M4-READONLY-RESEARCH-V1","wall_clock_minutes":20},"execution_helper":{"git_blob_oid":"730b0d50d61abb2e323398ae507d7d5f50470a19","minimum_windows_powershell_version":"5.1","modes":["SelfTest","CheckAll","TaskId"],"path":"evals/m4/execution/prepare_m4_1_request_bundles.ps1","raw_sha256":"ab0f82438d28a8b704075772889028e4f0eeab10eb1ec294df7fc3d0eb06d2e0","read_only":true,"request_binding_count":60},"launch_claim":{"claim_consumes_authorization_token":true,"claim_count_before_execution":0,"must_be_absent_before_execution":true,"must_be_created_before_first_task":true,"path":"evals/m4/execution/m4.1/launch-claim.json"},"milestone":"M4","permissions":{"aggregation":false,"blind_mapping_access":false,"cross_task_result_read":false,"followup_message":false,"fresh_task_creation":true,"judge_execution":false,"m4_closure":false,"repair":false,"result_writes_below_frozen_roots":true,"retry":false,"threshold_claim":false},"prelaunch_counters":{"authorized_tasks":0,"created_contexts":0,"dispatched_tasks":0,"finalizations":0,"judge_scores":0,"repairs":0,"results_observed":0,"retries":0,"unauthorized_side_effects":0},"preparation":{"ci_run_id":31248424046,"git_blob_oid":"42a10d36e4d64ab98aa724114b904001107f557d","head":"fedc5cdeebd7a2943afeb6767d39841305c55444","path":"evals/m4/revisions/m4.1/preparation-manifest.json","raw_sha256":"d66ad9d513d8e64307f9a1553242d9b7d840ea5432d084b06d86707c1b4c2b61","request_binding_count":60},"request_policy":{"configured_default_model_required":"gpt-5.6-sol","configured_default_reasoning_effort_required":"max","environment_type":"worktree","model_field":"OMITTED","one_independent_finalization_per_task_id":true,"one_new_thread_per_task_id":true,"project_id":"ff35b25f-4644-41c8-9073-74c697559439","starting_branch":"codex/m4-cross-engineering-forward-evaluation-m4.1-one-shot-authorization","surface":"codex_app.create_thread","target_type":"project","thinking_field":"OMITTED"},"revision":"M4.1","schema_version":"m4.1-execution-control-v1","status":"READY_UNCONSUMED","task_protocol":{"path":"evals/m4/task-protocol.md","raw_sha256":"bf52fe558358036cffe37b6390bfeaf896aa45152b31a6777552de0f44b36468"},"tasks":[{"allowed_context_paths":["evals/m4/cases/electrical-b.json","evals/m4/task-protocol.md","evals/m4/variants/A2/instructions.md"],"arm_id":"A2","attempt_limit":1,"batch_id":"M4.1-BATCH-ELE","blind_id":"M4-J061","case_id":"M4-ELE-B","case_path":"evals/m4/cases/electrical-b.json","case_sha256":"f5a12ee5e4abf7e1628c627ce25e1978c525e653f46711e22052bd9108615096","case_type":"adversarial","cross_task_result_visibility":false,"domain":"electrical_engineering","execution_constraints_sha256":"e27994e23e8ac35ab8b8ea1d3627d6de03591a74faf78dd5b0f8bc969d0f643e","forbidden_context_roots":["evals/m4/results","evals/m4/execution"],"independent_finalization_required":true,"request_binding_sha256":"95e4adab4269624a7cedb56a5a9e26d5d8a55de93b224841a7c19aa424782657","result_root":"evals/m4/results/m4.1/M4.1-ELE-B-A2","result_root_must_be_absent":true,"rubric_sha256":"36056affa68cba4e39c8281ef88fc9460b39a1158b8c52b718a2235d2bc5196a","source_batch_id":"M4-BATCH-ELE","source_blind_id":"M4-J001","source_task_id":"M4-ELE-B-A2","task_id":"M4.1-ELE-B-A2","task_protocol_sha256":"bf52fe558358036cffe37b6390bfeaf896aa45152b31a6777552de0f44b36468","user_input_sha256":"92e0f4fbc1decab17a8f1025987c771fc244a9671e908ae3c82cf98e6633568e","variant_instruction_path":"evals/m4/variants/A2/instructions.md","variant_instruction_sha256":"37ba950aa17bece479189aee6abaebc625845c136361b4a6d82ae0e14516cb2d"},{"allowed_context_paths":["evals/m4/cases/electrical-b.json","evals/m4/task-protocol.md","evals/m4/variants/A1/instructions.md"],"arm_id":"A1","attempt_limit":1,"batch_id":"M4.1-BATCH-ELE","blind_id":"M4-J062","case_id":"M4-ELE-B","case_path":"evals/m4/cases/electrical-b.json","case_sha256":"f5a12ee5e4abf7e1628c627ce25e1978c525e653f46711e22052bd9108615096","case_type":"adversarial","cross_task_result_visibility":false,"domain":"electrical_engineering","execution_constraints_sha256":"e27994e23e8ac35ab8b8ea1d3627d6de03591a74faf78dd5b0f8bc969d0f643e","forbidden_context_roots":["evals/m4/results","evals/m4/execution"],"independent_finalization_required":true,"request_binding_sha256":"4449e7a668cc942e802e413c4bddd72f86e20c9cef69ad41963c6581091e5a64","result_root":"evals/m4/results/m4.1/M4.1-ELE-B-A1","result_root_must_be_absent":true,"rubric_sha256":"36056affa68cba4e39c8281ef88fc9460b39a1158b8c52b718a2235d2bc5196a","source_batch_id":"M4-BATCH-ELE","source_blind_id":"M4-J002","source_task_id":"M4-ELE-B-A1","task_id":"M4.1-ELE-B-A1","task_protocol_sha256":"bf52fe558358036cffe37b6390bfeaf896aa45152b31a6777552de0f44b36468","user_input_sha256":"92e0f4fbc1decab17a8f1025987c771fc244a9671e908ae3c82cf98e6633568e","variant_instruction_path":"evals/m4/variants/A1/instructions.md","variant_instruction_sha256":"271a4389f6b07286fd57b64b51c30862e30b2f6fd742dbd77d4fbbfb1c4e7018"},{"allowed_context_paths":["evals/m4/cases/mechanical-a.json","evals/m4/task-protocol.md"],"arm_id":"N","attempt_limit":1,"batch_id":"M4.1-BATCH-MEC","blin